,10,"Korey Lee","CHW","C","MLB",2023,"40+","High",,"25.1833333","6' 2""","210","R","R",2019,"Draft","HOU",1750000,"Cal","Lee’s arm strength behind the dish is astounding, but it remains to be seen whether a 70 arm is enough to make up for a 30 bat when it comes to his viability as a primary big league catcher. He was dealt to the White Sox from Houston as part of the Kendall Graveman trade, and struck out 22 times in 14 Triple-A games before being called up to the big league roster. In his short 24-game stint to close out the major league season, he maintained the anemic offensive numbers that characterized his time in the minors, struggling mightily to make meaningful contact and recording just five hits in 70 plate appearances. There are examples of players who took time to finally tap into their in-game power, like Tigers catcher Jake Rogers, whose bat lay dormant for a couple of big league seasons before suddenly erupting into a 21-homer season last year as a 28-year-old. If Lee can follow a similar path, there’s a chance he earns an everyday catcher designation, but the path is narrow and rarely traveled, with a backup catcher role the more likely outcome.",,"25543"
,7,"Sam Bachman","LAA","SIRP","MLB",2023,"40","High",,"24.7833333","6' 1""","235","R","R",2021,"Draft","LAA",3850000,"Miami (OH)","A low-slot slingin' relief prospect, Bachman sat 91-94 mph during the short 2020 college season, then began to show a velo uptick in that fall, working 94-96 with huge tail. He was often throwing harder than that in 2021 at Miami of Ohio, sitting 96-97 most of the time and touching 101. The huge uptick put him firmly in the first round picture. Some teams thought he should go close to pick 10, while others had him slotted closer to 40 due to relief projection and his injury history (hip, shoulder). He's had further health issues in pro ball (back, biceps). After 26 walk-prone innings with Rocket City to start 2023, he was promoted to the big leagues and moved to the bullpen.
Bachman utilizes a slider-heavy approach in the extreme, as his 63% usage is top 10 in the majors among pitchers with at least 10 innings. It looks and plays more like a cutter in the strike zone, and has almost exactly zero vertical and horizontal movement. It's most obviously a slider when Bachman is locating it for swings and misses. Because he uses his mid-90s fastball as more of a chase pitch than one geared for in-zone strikes, Bachman will probably always be walk-prone, but his true talent for strike-throwing is better than what he's put on paper so far in 2023. He has more or less scrapped his changeup so far in the big leagues, but if Bachman is going to be more than just a generic middle inning guy, that has to be a part of his repertoire, if only to give lefties a third thing to worry about. He's tracking in line with his pre-draft floor as a quick-moving rank and file reliever.","SggUgRmmvlM","29754"
,23,"Xzavion Curry","CLE","SP","MLB",2023,"40","Med",,"25.1777777","5' 11""","195","R","R",2019,"Draft","CLE",125000,"Georgia Tech","Curry's secondary pitch command seemed to regress a bit in 2022, and it was merely average after he walked only 16 batters in 19 starts during his debut season in '21. It's important to his secondary pitches' effectiveness that Curry have precise command because none of them is especially nasty. He has feel for locating his terse slider, but his curveball (which pairs nicely with his fastball's shape and angle) and changeup are much less consistent. He still pounds the zone with his fastball, though, and Curry maintained the modest uptick in velocity that he showed in 2021. He's dependent on deception and his fastball's angle and ride, which are created by Curry's drop-and-drive delivery as well as a short, compact arm path and perfectly vertical arm slot. All of those components together help to create an illusion of rise and a tough-to-square line on his low-90s heater, and the slot helps him create vertical action on his breaking stuff. Barring a feel-for-location bounce back that would enable his stuff to play better than it did in 2022, Curry now looks like a fifth starter.",,"25595"
,14,"Connor Seabold","COL","SP","AAA",2023,"40","Low",,"27.6861111","6' 2""","190","R","R",2017,"Draft","PHI",525000,"Cal State Fullerton","Drafted by the Phillies in 2017 and traded to the Red Sox in 2020, Seabold made his major league debut with the Sox in 2021 and it's taken him a while to establish himself as a big league rotation piece, in part due to injury. His 2021 (elbow) and 2022 (forearm extensor strain) seasons both featured time on the shelf. About a month before 2023 spring training began, the BoSox traded Seabold to Colorado for a Player To Be Named Later. He looked healthy at the start of camp, when he sat his usual 90-94 mph with uphill plane, which has continued into the season as he's transitioned from the Rockies' bullpen into their rotation. 
Seabold throws a ton of strikes with his fastball and slider, which has become his go-to secondary. His slider, which tops out around 87 mph, is unusually hard for a guy whose fastball sits about 92. Seabold can also turn over a good low-80s changeup, which used to be his best pitch; while it still induces its fair share of chases and whiffs, it is closer to an average pitch than plus. His changeup usage has been on the rise since he hopped into the rotation. A cogent four-pitch mix and plus command make Seabold a high-probability backend starter, though his fastball might prove to be extremely vulnerable at Coors Field.","93iLjbuuNFU","19695"
,19,"Brenton Doyle","COL","CF","MLB",2024,"40","High",,"25.3805555","6' 3""","210","R","R",2019,"Draft","COL",500000,"Shepherd","Doyle was a toolsy draftee from Shepherd University, a tiny Pennsylvania State Athletic Conference program (a conference that has given us the likes of Joey Wendle, Matt Festa, and Ryan Vogelsong) in West Virginia that also had a QB prospect for this year's NFL Draft (Tyson Bagent — look it up, nerds). Doyle has huge tools and one of the best physiques in professional baseball. He is a plus-running athletic freak capable of hitting huge pull-side homers and making incredible defensive plays in center field, it's just that Doyle's pitch recognition is still sushi raw as he approaches age 25, and he may not hit enough to play a meaningful big league role. He has punched out in 31% of his career full-season plate appearances, a ruby red flag. He also hit 26 homers and stole 23 bases (in 26 attempts) last season, but his overall line (almost entirely at Double-A Hartford) was still a shade below the average (96 wRC+) in the Eastern League. 
Of course, prospects from such small programs deserve ample time to adjust to pro quality pitching, but Doyle has now been in the Rockies system for nearly half a decade and hope that he might be able to do that is becoming less reasonable by the day. Doyle is still a prospect of extreme variance and volatility, but his center field defense should allow him to play some sort of big league role even if his hit tool bottoms out and he ends up being a right-handed version of Bradley Zimmer. He's been up in Colorado since late-April and has been tracking right in line with his pre-call-up eval as a rookie.",,"25479"
,15,"Joey Wentz","DET","SP","MLB",2023,"40","Med",,"25.9861111","6' 5""","209","L","L",2016,"Draft","ATL",3050000,"Shawnee Mission East HS (MO)","Wentz was one of the more sought after high school pitchers in the 2016 draft and an under-slot agreement with Ian Anderson at no. 3 overall helped facilitate his $3 million deal. Traded to Detroit for Shane Greene in 2019, Wentz has mostly held serve as a prospect, retaining arm strength similar to what he showed in high school while adding a pitch and overcoming a TJ. Wentz will routinely sit 92-95 mph and mix in his three secondary pitches a ton. He has four distinct offerings but can really only throw his fastball for strikes with any consistency, as all three of Wentz's other pitches had a strike% lower than 56% in 2022. The unpredictable mix helps Wentz' otherwise vanilla stuff to play, and his big, innings-eating frame portends a stable no. 5 starter future.","qGBi5_ZAt5c","19962"
,19,"Mason Englert","DET","SP","MLB",2023,"40","High",,"23.9166666","6' 4""","206","S","R",2018,"Draft","TEX",1000000,"Forney HS (TX)","Englert’s second healthy pro season was fantastic, as he made 24 healthy starts and pitched just shy of 120 innings with a 30% K% and a 7% BB%, commanding four pitches with aplomb while reaching Double-A at the end of 2022 with Texas. The Tigers made him their Rule 5 draft pick and Englert made the roster coming out of camp, providing length in low leverage spots out of the bullpen. He doesn't throw very hard, sitting 90-94 mph and living off deception created by his arms-and-legs delivery and odd angles. After that, Englert mixes in an above-average changeup and two solid breaking balls — a mid-80s slider and upper-70s curveball — both of which he commands. He probably doesn't have a huge long-term ceiling, but Englert’s feel to pitch is polished enough for him to have essentially made the leap from High-A to the majors. After a year in long relief it's feasible the Tigers could option him and reengage with Englert as a starter, especially if he's maintained an approximately 100-inning workload as a long reliever in 2023.",,"22288"
,12,"J.P. France","HOU","SP","MLB",2023,"40","Low",,"28.4916666","6' 0""","216","R","R",2018,"Draft","HOU",1000,"Mississippi State","France looked like a five-pitch backend or spot starter for most of his minor league career, but he's had a little velo spike in 2023 (going from averaging 92.5 to 94 mph) and now looks like a sure bet to stick in a big league rotation. France attacks with a heavy dose of four-seamers and cutters, with the former riding above the zone while the latter has late action to his glove side. The cadence of France's delivery tends to catch hitters by surprise, as it is complete almost as soon as it starts, causing his fastball to jump on hitters on first look. The natural cut action on the heater keeps it off barrels and helps France garner a weirdly high groundball rate for a guy with an uphill fastball. His breaking ball shapes run the gamut, with the cutter, slider, and curveball all working with different shape, depth, and velocity. The mid-70s curveball breaks almost straight down, while the slider is between it and the cutter. An inconsistently located changeup rounds out the whole repertoire, which has enabled France to punch out more than a batter per inning for basically his entire career. He's a plug-and-play fifth starter.",,"21212"
,18,"Corey Julks","HOU","RF","AAA",2023,"40","Low",,"27.5944444","6' 1""","185","R","R",2017,"Draft","HOU",,"Houston","Houston really let Julks air out at High-A through about 150 games combined in 2018 and 2019, so when played resumed in 2021, he was an old-for-the-level guy at Double-A who had an over-the-fence power breakout, nearly doubling his career home run total by yanking out 14 bombs. Julks followed that up with a 31-homer campaign with Triple-A Sugar Land in 2022, but his .270/.351/.503 line was only good for a 108 wRC+ in the hitter-friendly PCL. He played his way onto the big league roster during the spring of 2023, and even though the Astros' right-handed redundancy makes his presence there tenuous, Julks should get to enough power to play a small, short-side platoon role in an outfield corner throughout his career. 
His swing is geared to pull in the extreme, and Julks is great at snatching inner third fastballs even though his leg kick is big and elaborate. He's going to pepper the Crawford Boxes with lots of hard contact — so many of his 2022 homers were tucked into the left field corner. As you might guess because he's so pull-heavy, Julks tends to swing inside a lot of sliders. He has the athletic ability to bend at the waist, dive to the outer part of the plate and power the ball the other way, but it's rare for him to stay on sliders long enough to do that. You'll see oppo pop more often on middle-away fastballs. Though not an especially good defender, Julks has a strong arm. He's a nice complement to a lefty-hitting platoon partner of some kind, but the Astros don't really have that on their active roster.",,"20311"
,27,"James Outman","LAD","RF","AAA",2023,"40","High",,"26.3805555","6' 3""","215","L","R",2018,"Draft","LAD",157500,"Sacramento State","Outman is a pull-and-lift hitter who has above-average power and speed that has helped him go from small school college prospect to imminent big league contributor. His uppercut swing helps him hit the ball in the air regularly (he hit a whopping 31 homers in 2022), and his ball/strike recognition helps him hunt pitches he can damage. A lack of barrel control and in-zone vulnerability against letter-high fastballs means he will likely end up with a 40-grade hit tool at best, and one source was also bothered by his breaking ball recognition. A lefty-hitting outfielder with this kind of power, even with a below-average hit tool, is typically a solid big league role player as the larger half of a platoon. Outman's feel in center field is only fair, and while he can play out there in a pinch, he's better suited for right field, where he played all but a few times during the back half of 2022. Of all the outfielders who figure to be competing for a 2023 big league roster spot, only Outman and Jason Heyward hit left-handed, making them a particularly good fit with some combination of the righty-hitting Chris Taylor, Miguel Vargas, and J.D. Martinez as the LF/DH group.",,"24770"
,21,"Dominic Canzone","SEA","RF","AAA",2024,"40","Low",,"26.125","6' 1""","190","L","R",2019,"Draft","ARI",170300,"Ohio State","Canzone is in the middle of a monster season at Triple-A Reno, where the nearly-26-year-old (who's repeating the level) has as many walks as strikeouts and is on pace for over 30 bombs. He has above-average pop from the left side and has kept his strikeout rates hovering around the 20% mark as he's hit for power at Arizona's upper-level affiliates. His hard-hit rate (41%) is a shade above the big league average, which is true of most of Canzone's power-measuring underlying metrics, but his contact rates tend to be a shade below (he's a bit of a bucket strider and can open up too soon on stuff breaking away from him) and he's a corner-only defender. The defensive component likely played a role in Arizona leaving Canzone off of their 40-man roster while they added Barrosa and Fletcher, as Canzone's offensive ability is about the same as the latter's. He still projects as an above-replacement corner platoon bat, probably one of relatively low impact because the power isn't monstrous. The Diamondbacks outfield mix is very crowded and it's perhaps more likely that Canzone is dealt somewhere with roster opportunity.",,"26438"
,19,"Jonny DeLuca","LAD","RF","MLB",2023,"40","Med",,"26.0055555","6' 0""","200","R","R",2019,"Draft","LAD",300000,"Oregon","DeLuca left Oregon as a speed-first switch-hitter but ditched switch-hitting in pro ball and he's also gotten much stronger. He broke some of the equipment the Dodgers use to measure lower body strength and climbed the minors in their system before coming to the Rays in the Tyler Glasnow trade. and is now more of a well-rounded, righty-hitting outfield prospect with a fair blend of contact and power, both of which are slightly undercut by his swing decisions. While he's capable of playing all three outfield spots, DeLuca is a 40 in center field and his best fit is in right. He doesn't have a corner regular's tools, but he does enough stuff well to have obvious big league roster utility, pinch-hitting here, pinch-running there, representing a defensive upgrade once in a while and getting the occasional start against a left-hander. That's a modern fifth outfielder. He was added to the 40-man after the season, and with Los Angeles' outfield situation in flux, he's likely to debut at some point in 2023.",,"26365"
,15,"César Salazar","HOU","C","AAA",2023,"40","Low",,"28.325","5' 9""","185","L","R",2018,"Draft","HOU",160000,"Arizona","Salazar is an excellent defensive catcher with an incredibly quick exchange and accurate arm. He's become strong enough to frame pitches better than he did when he entered pro ball, and he uses a dynamic style that mixes catching from a traditional crouch and on one knee, sometimes switching from one to the other while the pitch is mid-flight. Salazar has a minimalistic swing that prioritizes contact. He covers most of the plate but is only regularly able to do damage against pullable high pitches. This is a big league-ready backup catcher in his second option year.",,"21587"
,18,"Chris Murphy","BOS","MIRP","MLB",2023,"40","Med",,"26.1027777","6' 1""","188","L","L",2019,"Draft","BOS",200000,"San Diego","Murphy has had a two-tick velocity bump over the span of a couple of weeks. His fastball averaged 92 mph at Triple-A through mid-May and Murphy was getting shelled. It steadily climbed over the course of his next few starts and he's suddenly sitting 94-95. All of his other offerings also saw a bump. This has been meaningful for the way his slider (which is now basically a cutter) is playing — it's just nastier at about 88 mph. Murphy has a starter's mix, but I'm not sure a guy this size can let it rip like this for more than three or four innings at a time. That's fine — Murphy can still be an effective member of a staff in some kind of hybrid swingman role where he's mixing in all his pitches in an unpredictable, if somewhat inefficient, way.",,"26214"
,14,"Jordan Diaz","OAK","3B","AAA",2023,"40","Low",,"23.1333333","5' 10""","175","R","R",2016,"J2","OAK",275000,"Colombia","Diaz has whiff and chase metrics on par with good big league infielders, but his 54.4% swing rate would have ranked amongst the most swing-happy players in 2022. Still, he’s maintained a mid-teens (or lower) strikeout rate at every stop in the minors and combines that with an impressive ability to make contact throughout the zone to offset his miniscule walk rate. He also hit for more power in 2022, which is a welcome addition to his offense, especially if he ends up as a corner infielder. After debuting last season, he's played a couple dozen games at the big league level in 2023, striking out more often than he had in the minors (though still not at a concerning rate), but also belting four home runs, all on hanging sliders left over the middle of the zone. He was sent back down to Triple-A at the end of May and seems to be focusing on refining his swing decisions; over a comparable sample, his 7.9% walk rate since returning to Las Vegas is nearly triple what it was in the majors, where just two of his 72 big league plate appearances resulted in a walk.
Diaz has historically been hard to place defensively. He’s got the arm strength for third but not the range, he’s on the small side for a first baseman, and he lacks sufficient speed for the outfield. As a result, the bulk of his big league innings in 2022 were spent at second base, where he’d spent virtually no time in the minors until 2023. While a move to the keystone could shift his profile from that of a corner bench player to an everyday roster presence thanks to his proven bat-to-ball skills, the introduction of the shift ban may mean that the range concerns that pushed him away from third base follow him to the middle infield and diminish his viability there as well. His ability to make contact should enable him to be a part-time, low-impact infielder at a few different positions.","cvGGb4kbXNc","22650"
,21,"Bryan Hoeing","MIA","MIRP","MLB",2023,"40","Low",,"26.95","6' 6""","210","R","R",2019,"Draft","MIA",227200,"Louisville","Hoeing pitched well as an upper-level starter in 2022 and made a brief big league debut. After a few starts early in 2023, he was moved to the bullpen and quickly promoted to the big league level. Each of his offerings has experienced at least a three-tick velo boost as he's shifted to relief, and his breaking ball has added nearly five. In addition to his added velocity, Hoeing has begun altering his position on the rubber depending on the handedness of the hitter. He works with heavy sink and tail, and has the repertoire depth to provide multi-inning length out of the bullpen.",,"26304"
,13,"Ryan Noda","OAK","1B","AAA",2023,"40","Low",,"27.5027777","6' 3""","217","L","L",2017,"Draft","TOR",125000,"Cincinati","Left vulnerable to the Rule 5 Draft thanks to the Dodgers' glut of 40-man talent, Noda was selected by the A’s as an obvious upgrade from the team’s big league alternatives at first base. Having far exceeded the league average offensive performance at every level of the minors during his career thus far, in 2022, Noda slashed .259/.395/.474 while walking 16% of the time at Triple-A. His refined approach allows for in-game power, which he has already flashed at the big league level this season. He is keenly aware of which offerings he’ll be able to damage (pitches middle-in), but he's very vulnerable to high fastballs and will likely end up with a 40-grade hit tool. The power and on-base parts of his game will have to carry all the water of his big league profile, but given that his major league walk rate is hovering around the 20% mark, he’s risen to the occasion. He has slotted in as Oakland's everyday first baseman in 2023 and thus far boasts one of the better wRC+ marks in baseball, but his advanced age dampens his overall value from a prospect perspective.",,"23312"
,19,"Brent Honeywell","SDP","MIRP","",2023,"40","Low",,"28.5027777","6' 2""","180","R","R",2014,"Draft","TBR",800000,"Walters State JC (TN)","A KBO team asked the Rays about Honeywell but he wanted to stay in the US, so Tampa Bay shipped the oft-injured, optionless former top 100 prospect to Oakland in the fall of 2021; the next spring he promptly went on the 60-day IL with a stress reaction in his elbow. Since 2017, Honeywell has only really been healthy for one year. After the 2022 season, he elected free agency and pitched for Escogido in the Dominican Winter League, where he showed good enough stuff that the Padres signed him to a minor league deal, and he looked good enough the following spring to break camp with their big league club as a long reliever. Honeywell is sitting about 95 mph and is still mixing in a traditional changeup with the slower screwball that made him famous. So long as he's healthy, he'll be a core part of the Padres bullpen, providing a four-to-six out bridge to the late-inning crew.","JC3Vetq_eAA","16466"
,20,"Tristan Beck","SFG","SP","AAA",2023,"40","Low",,"27.2694444","6' 4""","165","R","R",2018,"Draft","ATL",900000,"Stanford","Beck bounced back from a 2021 herniated disk to pitch 111 innings (mostly at Triple-A) in 2022, though his season ended early with another back injury. When healthy, Beck still looks like a backend starter, with a game defined more by arsenal depth than pure stuff. After a few Triple-A outings to start 2023, he was promoted and shifted into the bullpen, where he's been working between two and four innings per outing in long relief. Beck has three different breaking balls (a cutter, slider and curveball), and he pitches off of them frequently, with as much as a 15 mph gap between his cutter and curveball. While Beck's 92-95 mph fastball jumps on hitters because he lunges way down the mound, its life and movement are only fair. An above-average athlete whose line is direct to the plate, Beck throws plenty of strikes, with his health the only barrier to him starting. His stuff isn't so nasty that he's going to be a star, but if he can stay healthy, he'll almost certainly pitch toward the back of a rotation.","FNepnYH31gU","21584"
,17,"Bowden Francis","TOR","SP","MLB",2023,"40","Low",,"27.4416666","6' 5""","225","R","R",2017,"Draft","MIL",235500,"Chipola JC (FL)","Part of the return for Rowdy Tellez, Francis is a big-league ready righty with a sturdy, towering frame and an arm that has already proven capable of withstanding a huge workload. He threw 99 innings during the 2022 season, including two-thirds of a big league frame, then another 35.2 in the Puerto Rican Winter League, where he struck out 47 batters, walked just nine and posted a 0.78 WHIP. While his Triple-A strikeout rate wasn't quite as impressive, he’s a consistent strike-thrower, and even though his fastball sits in the 90 mph range, it has a good shape with ride, and has been an effective bat-misser at the top of the zone and just above it. Despite lacking a real headliner for his three-pitch arsenal, his command and feel are such that he still looks like a high-probability fifth starter.",,"20548"
,22,"Isaiah Campbell","BOS","SIRP","AAA",2023,"40","Med",,"26.9083333","6' 4""","225","R","R",2019,"Draft","SEA",850000,"Arkansas","Campbell was granted a medical redshirt in 2017 because of surgery to remove bone spurs from his elbow. His stuff wasn't totally back in 2018 and the Angels tried to buy low on the then-redshirt sophomore in the 28th round. He returned to school, his stuff bounced back, and Campbell went in the 2019 second round. He barely pitched in 2020 or 2021 due to the pandemic and a TJ. A move to the bullpen part of the way through 2022 helped Campbell's stuff tick up, and he's throwing two ticks harder so far in 2023 than he was on average last season. His delivery and on-mound athleticism are still scary but when he's been healthy, Campbell has thrown plenty of strikes and has two good pitches in his heater and nasty vertical slider. He's currently on the Mariners' 40-man and is a decent bet to debut at some point in the second half of 2023, projecting as a middle reliever.",,"25551"
