,6,"Jared Triolo","PIT","3B","MLB",2023,"45","Low",,"25.6472222","6' 3""","212","R","R",2019,"Draft","PIT",870700,"Houston","Triolo has long been viewed as a glove-first third baseman who'd likely have some big league utility, similar to D-backs third baseman Emmanuel Rivera. But as Triolo's pro success with the bat continued at a high level, and with Ke’Bryan Hayes manning the hot corner for the Pirates’ foreseeable future, the Pirates began searching for defensive alternatives in order to plug Triolo into their lineup. They're finding them. During a full season at Double-A in 2022, he saw time at third base, shortstop, and center field, and in 2023 he'll start seeing more time at second base. Triolo earned industry praise for his defensive aptitude and high marks for his baseball IQ and instincts. His acrobatics and creativity at third base make him a plus defender there. He clearly wasn't comfortable in center field during his brief time there last season, but he only played there once every couple of weeks and he isn't a firm ""no"" at the position, even if he is bad there right now. Given how good he is at third, it seems likely that Triolo will be a good defensive second baseman if given enough time, and he's a fine emergency option at short (Kyle Farmer has played there a ton and Triolo is about that good).
What's more, there's a chance Triolo hits enough to simply be an everyday option at second (or if he turns out to be okay in center). He spent much of the season leading off for Altoona, where he slashed .282/.376/.419 and stole 24 stolen bases. His swing decisions and ability to make contact out front and tap into his latent power improved throughout the season. If you split his season exactly in half, the improvement is obvious. While his walk and strikeout rates were both descent through the first half of 2022, only nine of his 57 hits through mid-June went for extra bases (eight doubles and a home run). From that point on, however, Triolo walked more and struck out less, such that both rates sat in the mid-teens, while flipping the slugging switch on to the tune of 13 doubles, five triples, and eight home runs over the course of the same number of games. This impressive performance inspired his offseason 40-man addition. Triolo's swing and footwork in the box make him vulnerable in a couple of obvious ways (high heat, sliders away), and we don't think the 60-grade hit, 45-grade power profile that he has put on paper so far will hold quite that much water against big league arms. If it does, he should be a 50, and that grade was discussed during the Pirates list-making process. If a clearer path at third base existed in this org, that might have been enough for us to do it. Instead, Triolo looks like he'll be a superutility guy.",,"25807"
,9,"Cody Bradford","TEX","SP","MLB",2023,"45","Med",,"25.6083333","6' 4""","197","L","L",2019,"Draft","TEX",700000,"Baylor","Bradford missed his draft spring at Baylor due to thoracic outlet syndrome and then had no 2020 comeback for obvious reasons. He rocketed through the Rangers system, reaching Double-A in his first pro season and the big leagues in his third. Bradford is a classic pitchability lefty with a plus changeup and exceptional command. His upper-80s fastball plays up because of its rise and the nearly seven and a half feet of extension Bradford generates down the mound. He has dictatorial control over his entire repertoire, working his fastball up and to his glove side and then pitching off that with a mid-80s cutter/slider. Normally I'd 40 a guy like this and call it a day, but Bradford's command and deception elevate his entire mix. He's a big league ready no. 4/5 starter.",,"27597"
,13,"Enmanuel Valdez","BOS","2B","MLB",2023,"45","Med",,"24.7583333","5' 9""","190","L","R",2015,"J2","HOU",450000,"Dominican Republic","Valdez has been among the more divisive prospects here at FanGraphs during his time on the radar, at times evaluated as a positionless prospect with a relevant hole in the top of his swing, and at others as a versatile, well-rounded lefty stick likely to play an integral part-time role. His 2022 season, during which he hit .296/.376/.542 and tallied 65 extra-base hits against upper-level pitching, solidified him as the latter, and he was part of the two-player package that came back from Houston for Christian Vázquez.
Valdez packs quite a wallop for a 5-foot-9 hitter. He swings really hard and is capable of hitting for power to all fields, turning on pitches that find the inner third of the plate and bending to spray hard contact the other way against stuff finishing away from him. His hands are a little noisy as they load, and he has a bit of a hitch before they fire, but his levers are so short that he tends to be on time anyway. His stance and aggressive, uphill swing are like a cover band's rendition of Juan Soto's cut. Vulnerable to fastballs running up and away from him (even ones that finish in the zone), Valdez's hit tool will likely settle in south of average, but he's going to get to considerable power thanks to his bat speed and damage-seeking style of swinging. 
He has experience in both outfield corners and at every infield position but shortstop, seeing time most frequently second base, where he has played almost exclusively during his 2023 big league debut. Like a dull Swiss Army knife, he isn't especially good at any of them. He'll make some sweet plays out of sheer effort but struggles at other times due to below-average range, hands, and actions, frequently costing the team an out on double play attempts due to a slow pivot (his feeds to the bag tend to be good, though). The death of the shift will further stretch him on defense, and he might end up playing more 1B/LF than anywhere else over time, but there's enough platoon-friendly offense happening here to consider Valdez a core part-time player.",,"21716"
,8,"DL Hall","BAL","MIRP","MLB",2023,"45","High",,"25.0333333","6' 2""","210","L","L",2017,"Draft","BAL",3000000,"Valdosta HS (GA)","Hall might have debuted at some point in 2021 had he not dealt with elbow tendinitis and a stress reaction in his elbow, which was uncovered when he had a setback during rehab from the tendinitis and ultimately ended his season. He began the 2022 slate on a delay and rehabbed in extended spring training until the very end of April. Quickly thereafter he was at Triple-A Norfolk and looked like the usual DL Hall, wielding three plus pitches and struggling with walks. In mid-August, the Orioles moved Hall to the bullpen, and after just four relief appearances over a span of 12 days, he was promoted to Baltimore for a 13-inning cup of coffee. Hall didn't throw harder in a relief role — he was still parked in the 95-97 mph range — and in fact his velo keeled off a little bit right at the very end of the season. His plus velocity and uphill approach angle make Hall's fastball extremely difficult for hitters to get on top of, and righty batters who are trying to anticipate the heater often end up embarrassing themselves against his changeup, which generated a whopping 54% whiff rate in 2022. His slider (Hall was almost exclusively a fastball/slider pitcher against lefties during his big league run) is firm and now has better movement demarcation from his curveball, which is easily his least-used offering, usually a backdoor option to righties. It's possible that aspects of his repertoire will be pared down in relief. Even as a pure reliever at this point, Hall still belongs on a Top 100 list due to his proximity and the likelihood that he becomes a lights out lefty closer or multi-inning buzzsaw who provides some amount of karmic retribution for the Josh Hader trade.","uN2TRUVwjs4","22207"
,11,"Gabriel Arias","CLE","SS","MLB",2023,"45","High",,"23.5944444","6' 1""","217","R","R",2016,"J2","SDP",1900000,"Venezuela","Arias was part of San Diego’s huge 2016 international signing class, inking a deal worth just shy of $2 million. He quickly became the most promising of the young infielders the club signed that year and was pushed to full season ball late during his age-17 season, well out ahead of the others in his class. After a rough statistical 2018 as a very young player at Low-A Fort Wayne, Arias had great seasons on paper in '19 and '21, the latter coming after Cleveland had acquired him from San Diego as part of the Mike Clevinger trade and skipped him over Double-A. He hit .284/.348/.454 as a 21-year-old with Columbus before regressing in 2022, when he essentially repeated the level. Injuries and ineffectiveness at first base on the Guardians' big league roster pressed Arias into action at an unfamiliar position during their playoff series with the Yankees. He then picked up about a month's worth of games in Puerto Rico during the winter. 
Arias' approach and hit tool scare scouts and analysts, but he's grown into considerable power as his body has matured, and this has occurred without detracting from his fantastic infield defense. He is extremely strong for a legit defensive shortstop — you can see Arias' lats through his jersey for goodness sake — and while he doesn't have especially precise feel for contact, he tends to smoke the balls he does put in play. His 43% hard-hit rate in 2022 would have been in the top five among qualified big league shortstops, it's just that Arias' hardest contact tends to be on the ground. Chase and whiff prone in the zone, this looks like a player who'll wind up with a 30-grade hit tool and run career OBPs in the .290-.310 range. Willy Adames is a wildly successful version of this kind of skill set, but his rate contact stats and the lift in his swing are both superior to Arias', so that's definitely not a comp. Instead, Arias' glove is likely to be what dictates his role as a utility infielder with an atypical skill set for this org. His power gives him a chance to have some peak years with 20-plus homers, maybe more if Arias can find a swing that better taps into his raw thump.","bzG6c8ZDi_g","22563"
,7,"Esteury Ruiz","OAK","CF","AAA",2023,"45","Med",,"24.6277777","6' 0""","169","R","R",2015,"J2","KCR",100000,"Dominican Republic","Ruiz began his pro career with the Royals and was traded to the Padres in 2017 as part of a six-player swap that included Travis Wood and Matt Strahm. After a few years toiling away in San Diego's org while struggling with chase, Ruiz posted a 2022 stat line that will give you a strong urge to check for typos. He slashed .332/.447/.526 and, absurd as it may seem, Ruiz stole 85 bases last year. He started the season at the Padres’ Double-A affiliate, where he swiped 37 bags in 49 games, then moved up to Triple-A and increased that clip to 23 bags in 28 games. He was then dealt to the Brewers as part of the Josh Hader trade and added another 25 steals in his 37 games with Triple-A Nashville. He was traded yet again during the offseason as part of the Sean Murphy three-team swap and has slotted in as Oakland's regular center fielder in 2023. 
Having played second base up until 2019, Ruiz moved to the outfield when play resumed in 2021 after the lost pandemic season and has stayed there ever since, primarily in center with a smattering of innings in either corner. His speed is a natural fit in the outfield, and those wheels help make up for slightly below-average instincts and a second baseman’s arm. The progress he's made as a defender in center field is the most important component of his profile. So far this year, Ruiz has shown an affinity for situational hitting, posting an eye-popping slashline with runners in scoring position despite a rather anemic one overall. But as predicted, he’s proven to be a speed-first player, leading the majors in stolen bases over the first several months of the season. Due to his grooved, pull-heavy swing, we're still inclined to think he's more likely to be a nine-hole hitting speedster with a solid glove and very little bat, basically a fourth outfielder on a contender.","PgBHF2I2c08","21780"
,6,"Matt Wallner","MIN","RF","MLB",2023,"45","Med",,"25.8027777","6' 4""","220","L","R",2019,"Draft","MIN",1800000,"Southern Mississippi","Wallner hit for power during all three years of his college career at Southern Mississippi, even while pitching part-time as a freshman and sophomore. While some scouts thought he had pro potential as a hurler, an arm injury kept him off the mound during his junior year and Wallner's huge raw power carried most of the water for his draft profile. He had some of the most explosive raw thump in the 2019 draft class, drawing 70 or 80 grades from scouts. 
The 2021 season was Wallner's first full pro campaign, and he hit 15 homers in just 66 games (slashing .264/.350/.508) as an old-for-the-level 23-year-old at High-A. His season was interrupted by a broken hamate, which can sometimes sap power output for many months after surgery to remove the broken bone, but Wallner slugged .465 in the 50-ish games he played after returning from surgery and kept on hitting for power against Fall League pitching. He then proceeded to lead all the minor leagues in hard-hit rate in 2022. By a lot. Wallner had a 60% hard-hit rate last year, nearly eight percentage points better than Rays prospect Curtis Mead, who was second. Wallner was at or near the top of every measurable power category in the minors last year and slashed .277/.412/.542 with 27 homers in a season split between Double- and Triple-A. He tallied 63 extra-base hits in just 128 games and made his big league debut in September.
Why isn't this guy just a top 100 prospect? Well, Wallner is a liability on defense and his hit tool is pretty flimsy. While he has thunderous, impact power, there are fair questions about whether or not he'll get to it against big league stuff because of how often he swings and misses. He is often underneath high fastballs and over the top of offspeed stuff, even when both are finishing in the zone. His 70% Z-contact% last year would have comfortably ranked last among qualified big league hitters (Josh Donaldson's 75.5% mark was dead last in 2022). A below-average athlete with poor body control, Wallner is a bumbling outfielder and baserunner. It's possible he'll experience late growth in these areas because, after all, we're talking about a former two-way player who has missed significant time due to the pandemic and injury, but these will likely be long-term flaws in Wallner's game. Still, there is so much playable power here that Wallner is likely to be a strong-side platoon option as a RF/DH who has some years with 25-30 bombs.",,"26466"
,10,"Ji Hwan Bae","PIT","2B","AAA",2023,"45","Low",,"24.1805555","6' 1""","185","L","R",2017,"J2","PIT",1250000,"South Korea","After spending most of the year at Triple-A, where he hit .289/.362/.430, Bae spent the last couple weeks of the 2022 season as an everyday member of the big league club, where he seems likely to stick throughout the coming season as a lefty-hitting 2B/OF. He’s still the contact-first, chop-and-spray hitter he’s always been, an approach to hitting enabled and bolstered by his speed, which allows him to beat out infield singles. The type of contact he makes is unlikely to ever lead to home run power commensurate with a true everyday player, but Bae makes enough stinging, all-fields contact that he projects to hit plenty of doubles and triples. His defensive versatility will allow the Pirates to play in-game matchups that take advantage of Bae's speed and ability to put balls in play. He spent more of his big league time in the outfield than at his native second base. He doesn't always look comfortable out there, but his speed makes him viable at all three spots, solidifying his role as a heavily-used role player even without the power production.",,"23818"
,7,"Will Brennan","CLE","CF","AAA",2023,"45","Low",,"25.6638888","6' 0""","200","L","L",2019,"Draft","CLE",,"Kansas State","A two-way college player, Brennan hit the ground running as a hitter in pro ball and made it to the big leagues after just two full seasons in the minors. He has never struck out more than 16% at any level and raked at Akron and Columbus in 2022 before getting an 11-game cup of coffee at the very end of the season. He's a .296/.367/.435 career hitter in the minors, generating doubles power with a compact swing and all-fields approach to contact. He's especially adept at dropping the bat head to yoink liners into the right field corner, and his barrel stays in the hitting zone long enough to spray some outer edge fastballs to left. Big league pitchers exposed a vulnerability to high-and-away fastballs, and Brennan may have to make an adjustment to keep hitting at the rate he did in the minors. Outside of the doubles, he's probably not going to hit for significant power, so it's important that he find a way to make those adjustments to preserve his excellent bat-to-ball production. An instinctive center field defender, Brennan's capable glove should give him a consistent on-roster role as a strong-side platoon option thanks to his feel for contact and defense.",,"25660"
,6,"Ryan Pepiot","LAD","SP","MLB",2023,"45","Med",,"26.1111111","6' 3""","215","R","R",2019,"Draft","LAD",547500,"Butler","The stuff that kept Pepiot just outside the global Top 100 last year was evident again in 2022, as he struggled with walks at the big league level and his mid-80s slider/cutter doesn't appear to have the vertical depth to be a traditional bat-missing breaking ball. He's still a damn good pitcher who projects either as an inefficient five-inning starter or an excellent reliever capable of giving you four-to-six outs at a time. The angle and shape of Pepiot's fastball gives it bat-missing ability at the top of the zone even though it has average velocity, and his high-spin changeup is a plus offering that plays down because Pepiot's feel for locating it comes and goes. There are times when he can be effectively wild with the cambio, accidentally running it back over the glove-side corner of the plate in unhittable fashion, and then there are times when the pitch isn't enticing at all. Surprisingly, Pepiot's cutter generated the highest swinging strike rate of his three offerings in his 36 big league innings and, after he arrived in pro ball with a lousy curveball, he's developed a good enough breaking ball to have a starter's mix, it's just that the command component remains behind.","rolBnvOrIE0","26221"
,5,"Osleivis Basabe","TBR","2B","AAA",2023,"45","Med",,"23.05","6' 1""","188","R","R",2017,"J2","TEX",550000,"Venezuela","Poised to play a multi-positional infield role in the big leagues relatively soon, Basabe makes an over-aggressive approach and high-effort swing work via his fantastic hand-eye coordination and bat control, which have made him a .316/.375..434 career hitter in the minors. He takes such wild full-body hacks that sometimes he looks like he's going to faceplant in the batter's box, but Basabe finds all sorts of funky ways to put the bat on the baseball, usually in the form of high infield choppers and opposite-field line drives. We're talking about a 91% Z-contact rate in 2022, a 70 on the scale. Almost completely lacking over-the-fence power (he has just eight career homers in four seasons), Basabe is like a boxer who beats you with nothing but jabs. He's passable at shortstop but a better fit at third and second base, where he makes acrobatic plays through sheer effort, and his lightning-quick transfer makes him especially good at fielding high choppers that he has to get rid of quickly, which third base sees most often. He'll probably carve out a 250-ish plate appearance role with the Rays within the next few years.",,"23985"
,7,"Casey Schmitt","SFG","3B","MLB",2023,"45","Med",,"24.5833333","6' 2""","215","R","R",2020,"Draft","SFG",1150000,"San Diego State","After a second-half surge at Low-A in 2021, Schmitt climbed his way through the Giants system in 2022. He started the season at High-A, posting walk and strikeout rates better than the league average while slashing .273/.363/.474 with 17 homers in 93 games. He then played 29 games at Double-A, where he improved every column of his slash line while maintaining a strikeout rate close to the 22% mark he'd put up in Eugene. It was at this point, though, when his walk rates tanked into an area of concern, a trend that has persisted over the last year as Schmitt has made his big league debut. Schmitt’s difficulty adjusting to offspeed pitches in the zone and breaking balls below it generated worse-than-average swing-and-miss rates in 2022 (his under-the-hood contact data is worse than his raw strikeout rate), and it's a big reason why he's running a sub-.300 OBP so far in the big leagues. Sub-optimal swing decisions (he chased at a 33% clip in 2022 and is doing so at a whopping 48% in the big leagues as of list publication) have negatively affected the type of contact he's made, even though he did hit 21 homers last year.
Schmitt’s swing is a dead ringer for Anthony Volpe's, down to his closed-off setup and deep knee bend timed to the pitcher’s release, shifting his weight to his back leg before exploding toward the ball. This swing is designed to get under the ball consistently regardless of where it’s thrown, which makes Schmitt’s low average launch angle (more than 10 degrees lower than Volpe’s) and high groundball rate confounding. A lot of it is just poor secondary pitch recognition. Most of Schmitt’s minor league success came off of fastballs. At Double-A, he posted a 1.073 OPS on heaters, which accounted for 49% of the pitches he saw. Meanwhile, his slash line against offspeed and breaking balls was an anemic .216/.286/.333. Now that he’s seeing more offspeed and breaking pitches – and major league caliber ones at that – he’s struggled to make consistent, hard contact.
No write-up of Schmitt would be complete without singing a few bars of praise regarding his defense, which is really the bedrock of his prospect foundation and the biggest reason why he's still going to be a good big league role player. His instincts and hands at third base are tremendous, and he sweetens it with elite arm strength. He's seen a lot of big league time at shortstop and we don't think that's a great long-term fit, but it makes sense as a way of keeping Brandon Crawford fresh and gives Schmitt an opportunity to play all over the infield and develop as the utilityman he's likely to be.","P7KkeThVrZo","27577"
,6,"Garrett Mitchell","MIL","CF","MLB",2023,"45","High",,"25.075","6' 3""","225","L","R",2020,"Draft","MIL",3242900,"UCLA","A high-profile prospect since high school, Mitchell is now 24 years old and there are still key aspects of his skill set that are tough to evaluate and project. Even as his surface-level performance has been strong at virtually every level, there have been issues implied by his TrackMan data and visual flaws in his swing, both of which have made it hard for him to hit for power in games and may make it tough for him to hit big league pitching at all. Mitchell has above-average raw power and will flash it on occasion, but his swing makes it tough for him to elevate consistently, especially to his pull-side. He has a swing-and-miss hole in the top third of the zone and tends to only be able to put the ball in play on the ground in the bottom third, giving Mitchell a mistake-hitter look when you dig into his spray chart. The industry has been waiting for a swing change that might bring out the power more consistently, but that hasn't happened yet. A pro's physique, big strength, and straight line speed give Mitchell the appearance of high-end athleticism, but looseness, fluidity, and grace aren't part of the package. Some of what he's able to do on a baseball field leaps out at you, especially when Mitchell is hauling ass into the gaps, but athletic malleability does not appear to be one of them. Center field defense is easily Mitchell's most impactful tool. It's hard to find players who can actually play a big league center field and Mitchell is quite good out there, and he has an above-average arm. He shares many similarities with Bradley Zimmer, though Mitchell's plate discipline should enable him to perform like a 45 FV outfielder more consistently than Zimmer has.","hR-lcCg8R9A","27555"
,8,"Lenyn Sosa","CHW","2B","MLB",2023,"45","Med",,"23.6833333","6' 0""","185","R","R",2016,"J2","CHW",325000,"Venezuela","Sosa is a slow-twitch athlete without huge tools, but he can put the bat on the ball with remarkable consistency and is a high-probability big league role player as a result. While he's fairly heavy-footed and lacks the typical middle infielder's athleticism, Sosa has great feel for adjusting his footwork and body position so he can field grounders and turn the baseball around quickly. He barely has enough raw arm strength for the left side of the infield, but his quick hands and internal clock typically enable him to lob the ball over in time. A very aggressive swinger who has run walk rates in the low single digits throughout his career, Sosa is especially prone to chasing sliders off the plate, which he did at a 39% clip at his various 2022 stops according to Synergy Sports. Overall, though, he is an above-average contact hitter whose ability to get to power in a more traditional-looking way than the next prospect on this list should make him a second-division big league middle infielder. He could end up with a career similar to Wilmer Flores'.",,"22896"
